{
  "$schema": "../../../schema/high-vocational-profile.schema.json",
  "collections": {
    "clusters": "clusters.json",
    "courses": "courses.json",
    "coverageGaps": "coverage-gaps.json",
    "domains": "domains.json",
    "learningRelations": "learning-relations.json",
    "reviewRecords": "review-records.json",
    "standards": [
      "standards/agriculture.json",
      "standards/beauty.json",
      "standards/business-finance.json",
      "standards/chemical.json",
      "standards/construction.json",
      "standards/convergence-ip.json",
      "standards/culture-art-media.json",
      "standards/electric-electronics.json",
      "standards/env-safety-fire.json",
      "standards/fisheries-shipping.json",
      "standards/food-cooking.json",
      "standards/health-welfare.json",
      "standards/it-telecom.json",
      "standards/machinery.json",
      "standards/materials.json",
      "standards/specialized-common.json",
      "standards/textile-fashion.json",
      "standards/tourism-leisure.json"
    ],
    "subjectGroups": "subject-groups.json",
    "topics": [
      "topics/agriculture.json",
      "topics/beauty.json",
      "topics/business-finance.json",
      "topics/chemical.json",
      "topics/construction.json",
      "topics/convergence-ip.json",
      "topics/culture-art-media.json",
      "topics/electric-electronics.json",
      "topics/env-safety-fire.json",
      "topics/fisheries-shipping.json",
      "topics/food-cooking.json",
      "topics/health-welfare.json",
      "topics/it-telecom.json",
      "topics/machinery.json",
      "topics/materials.json",
      "topics/specialized-common.json",
      "topics/textile-fashion.json",
      "topics/tourism-leisure.json"
    ]
  },
  "counts": {
    "clusters": 4480,
    "courses": 528,
    "coverageGaps": 2,
    "domains": 4480,
    "learningRelations": 298,
    "reviewRecords": 1,
    "standards": 47625,
    "subjectGroups": 18,
    "topics": 47625
  },
  "createdDate": "2026-07-13",
  "curriculumVersion": "2022-revised",
  "profile": "high-vocational",
  "releaseId": "kr-2022-high-vocational-v0.6.0-candidate",
  "rightsStatus": "cleared",
  "schoolLevel": "high",
  "sourceManifest": "../shared/source-manifest.json",
  "status": "candidate",
  "textPolicy": {
    "officialTextIncluded": false,
    "summaryPolicy": "공식 성취기준 문장은 수록하지 않고 코드·locator와 기계적 초안 요약을 사용하며 전문가 검토 상태를 분리한다."
  }
}
